InputStoryid,DistortedSentenceIndex,Original_Sentence,Distorted_Sentence,Original_Story,Distorted_Story
f6aad64a-e34c-415d-b895-dbfa187ed43e,1,He had been working so hard this past month.,"He had been working so hard this last night.""",Bob was bored at his job as a school teacher. He had been working so hard this past month. He decided to treat himself with something special. He ordered tickets for a weekend snowboarding trip.,"Bob was bored at his job as a school teacher. He had been working so hard this last night."" He decided to treat himself with something special. He ordered tickets for a weekend snowboarding trip."
0fedd90d-5295-4b79-b2d0-15a2bad624ee,0,Olivia went out with Harry on a date.,Helen went out with Harry on a date.,Olivia went out with Harry on a date. Harry thought the date was going well. Olivia thinks he is a complete jerk and never wants to see him again. Harry keeps raving about their chemistry.,Helen went out with Harry on a date. Harry thought the date was going well. Olivia thinks he is a complete jerk and never wants to see him again. Harry keeps raving about their chemistry.
018152fd-f984-4d05-ad1e-12f1fb7eceb6,0,Jack and Ferris always fought for headphones.,Ferris always fought Jack for headphones.,Jack and Ferris always fought for headphones. One day Jack broke Ferris' headphones while jogging. Ferris was furious at Jack. Their parents yelled at them.,Ferris always fought Jack for headphones. One day Jack broke Ferris' headphones while jogging. Ferris was furious at Jack. Their parents yelled at them.
feef76df-b75a-4501-9c1a-f8a7b6ee442f,0,I needed someone to help me move a bed across the room.,"I needed someone who could help me move a bed across the room .""","I needed someone to help me move a bed across the room. I called a couple of friends, but they were busy. Finally, I called my grandson, who came right over. He helped me move the bed to the right spot.","I needed someone who could help me move a bed across the room ."" I called a couple of friends, but they were busy. Finally, I called my grandson, who came right over. He helped me move the bed to the right spot."
929eaf8b-a175-4460-a885-43be8a89ca62,0,Hannah had a beautiful cat that she loved very much.,Hannah had a beautiful dog that she loved very much.,"Hannah had a beautiful cat that she loved very much. However, she noticed that her cat was getting very old. One day, her cat ran away and never came back. Hannah was devastated.","Hannah had a beautiful dog that she loved very much. However, she noticed that her cat was getting very old. One day, her cat ran away and never came back. Hannah was devastated."
e65dec15-d9db-4369-a048-ca25046aea1a,0,Tony had a job interview!,Tony was fired from work!,Tony had a job interview! He got his suit ready! He forgot how to tie a tie! He quickly called his dad!,Tony was fired from work! He got his suit ready! He forgot how to tie a tie! He quickly called his dad!
bcce5b73-0c0a-4de9-9f0b-29b64d2055a5,1,He really missed home but he had to do his job.,He really liked home but he had to do his job.,"Jerry was in the army and deployed to a foreign country. He really missed home but he had to do his job. Finally, they gave him leave to visit his family. He got on the plane really excited.","Jerry was in the army and deployed to a foreign country. He really liked home but he had to do his job. Finally, they gave him leave to visit his family. He got on the plane really excited."
f07443b5-fece-45e3-8df4-92e5dd9898ca,2,"Finally, we made it to our favorite beach getaway!","""Before long, we were forced to give up on our favorite beach getaway!""","Today was the day we finally were leaving for vacation. We loaded our things and drove for six hours. Finally, we made it to our favorite beach getaway! We spent the next days playing in the waves and collecting seashells.","Today was the day we finally were leaving for vacation. We loaded our things and drove for six hours. ""Before long, we were forced to give up on our favorite beach getaway!"" We spent the next days playing in the waves and collecting seashells."
144f8b43-563a-44b1-b137-1b1e07e3752f,1,So I felt nervous while walking home one night.,"""So I felt calm while walking home one night.""",I had always been afraid of dogs. So I felt nervous while walking home one night. I saw what looked like a dog on someone's porch. And I started to run.,"I had always been afraid of dogs. ""So I felt calm while walking home one night."" I saw what looked like a dog on someone's porch. And I started to run."
2d45cd59-7c98-4fdf-b0a8-fa6abe745876,0,Ida really wanted hardwood floors in her living room.,""" Ida really hated hardwood floors in her living room "".","Ida really wanted hardwood floors in her living room. She worked overtime often to save up the money. Then she shopped for the flooring and had it installed. When she saw her new hardwood floors, she almost cried.",""" Ida really hated hardwood floors in her living room "". She worked overtime often to save up the money. Then she shopped for the flooring and had it installed. When she saw her new hardwood floors, she almost cried."
940388e1-1d00-4cc2-b6fc-3e4a56aa9c70,0,One day I was asked to write short stories.,"""One day I was asked to write short stories.""","One day I was asked to write short stories. It started out fairly easy, but then I ran into trouble. I soon found it hard to come up with new ideas. I didn't think it would be so hard.","""One day I was asked to write short stories."" It started out fairly easy, but then I ran into trouble. I soon found it hard to come up with new ideas. I didn't think it would be so hard."
38225711-dd12-4676-935e-bfef8d2ac2e8,2,She called her mom to see where her brother is.,""" She called her mom to see where her brother is .","Sophie was going to dinner with her brother. Sophie kept waiting at the restaurant, but her brother never came. She called her mom to see where her brother is. Her brother was home.","Sophie was going to dinner with her brother. Sophie kept waiting at the restaurant, but her brother never came. "" She called her mom to see where her brother is . Her brother was home."
1fb7be7c-b222-448b-b368-4ccd0d21695a,0,"This morning, health-wise, I felt great.","""This morning, health-wise, I felt miserable.""","This morning, health-wise, I felt great. However, as soon as lunch time came, I felt odd. I started sneezing and blowing my nose like crazy. I decided to take some vitamin C.","""This morning, health-wise, I felt miserable."" However, as soon as lunch time came, I felt odd. I started sneezing and blowing my nose like crazy. I decided to take some vitamin C."
2d519d87-9522-4e51-9f99-5330ebe001f6,1,She decided she needed a day off.,She decided she had a great day off.,Stacy woke up on the wrong side of the bed. She decided she needed a day off. She called out of work and went to the aquarium. She loved all the animals and felt relaxed.,Stacy woke up on the wrong side of the bed. She decided she had a great day off. She called out of work and went to the aquarium. She loved all the animals and felt relaxed.
b9cf0628-9ee9-4245-b5a0-fe3a816a67d8,2,I stayed up so late I almost missed the test.,"""I stayed up so early I almost missed the test.""",My first college exam was stressful. I had to stay up all night to study. I stayed up so late I almost missed the test. When it came time to take the test I still felt nervous.,"My first college exam was stressful. I had to stay up all night to study. ""I stayed up so early I almost missed the test."" When it came time to take the test I still felt nervous."
7fc6c821-3f4e-414b-88b2-5b72a7edd1cb,1,He had never made it to the top of a mountain.,""" He had always made it to the top of a mountain .""",Michael loved to go hiking in the woods on weekends. He had never made it to the top of a mountain. One day he climbed very high and finally reached the top. He could see land and water on the other side of the mountain.,"Michael loved to go hiking in the woods on weekends. "" He had always made it to the top of a mountain ."" One day he climbed very high and finally reached the top. He could see land and water on the other side of the mountain."
27954a1d-96c2-4d10-ba3c-766f9596aa5e,1,She wished to enter the lamb in the agricultural fair.,"""She wanted to enter the lamb in the agricultural fair.""",Mary had a little lamb. She wished to enter the lamb in the agricultural fair. She cleaned and combed it till it was beautiful. She entered it in the fair with other lambs.,"Mary had a little lamb. ""She wanted to enter the lamb in the agricultural fair."" She cleaned and combed it till it was beautiful. She entered it in the fair with other lambs."
aa9b53d2-3c47-4393-a059-9ef59c19efa5,1,Her family decided that weekend to throw an open house.,Her family decided that weekend to throw a funeral.,Dorothy had just turned ninety years old on Friday. Her family decided that weekend to throw an open house. Friends and family came from all around. There was food and a slideshow prepared to watch of Dorothy.,Dorothy had just turned ninety years old on Friday. Her family decided that weekend to throw a funeral. Friends and family came from all around. There was food and a slideshow prepared to watch of Dorothy.
c618bb30-f191-416e-9e84-35e0af74457f,2,"After a quick lesson, she mounted the horse.","""After a quick lesson, she broke free.""","Jenny wanted to learn how to ride a horse. She went to a local horse farm. After a quick lesson, she mounted the horse. A feeling of joy enveloped her as she rode the horse around a ring.","Jenny wanted to learn how to ride a horse. She went to a local horse farm. ""After a quick lesson, she broke free."" A feeling of joy enveloped her as she rode the horse around a ring."
0f20b37e-bb84-4373-a3ae-e7c2e4243b1c,0,Jill couldn't believe she was about to marry her best friend.,Jill couldn't believe she was about to marry her best friend.,"Jill couldn't believe she was about to marry her best friend. It was the night before, and she was out with the girls. She confessed to them that she was scared of marrying him. Her friends reassured her that she was actually in love with him.","Jill couldn't believe she was about to marry her best friend. It was the night before, and she was out with the girls. She confessed to them that she was scared of marrying him. Her friends reassured her that she was actually in love with him."
c8886984-5e07-4e41-be9f-89dda1794931,0,Cindy got out of bed.,"""Cindy got out of bed.""","Cindy got out of bed. But she couldn't find her slippers. Instead of making breakfast, spent all day looking for them. She gave up and ordered another pair.","""Cindy got out of bed."" But she couldn't find her slippers. Instead of making breakfast, spent all day looking for them. She gave up and ordered another pair."
98162ab1-d164-4566-9062-54c4efea5680,2,She decided it's time to start exercising.,She decided it's time to start eating.,Lucy looked in the mirror. She didn't like her look. She decided it's time to start exercising. The next day she ran and did sit-ups.,Lucy looked in the mirror. She didn't like her look. She decided it's time to start eating. The next day she ran and did sit-ups.
7f3f5bc9-f01f-420d-947d-a6fa9d301dab,0,Goku loves to fight.,"""goku hates to fight.""",Goku loves to fight. He has been training to fight since a very young age. Goku attended a fighting competition when he was fourteen. Goku has always managed to beat every one of his opponents easily.,"""goku hates to fight."" He has been training to fight since a very young age. Goku attended a fighting competition when he was fourteen. Goku has always managed to beat every one of his opponents easily."
51a80a55-0287-4074-90bb-68f07743bd2f,0,Jimmy wanted to get some work experience as a senior in college.,"""Jimmy wanted to get some work experience as a senior in college.""",Jimmy wanted to get some work experience as a senior in college. He applied as an intern to a construction company nearby. He really enjoyed working for them and was offered a position. Jimmy accepted the position as a full-time employee.,"""Jimmy wanted to get some work experience as a senior in college."" He applied as an intern to a construction company nearby. He really enjoyed working for them and was offered a position. Jimmy accepted the position as a full-time employee."
b0633441-dbb1-46c3-8871-573149a973be,0,Hayley wanted to learn how to defend herself.,"Hayley wanted to learn how to take a nap.""",Hayley wanted to learn how to defend herself. She had been attacked and raped before. She decided to attend self-defense classes. She ended up really loving it and being great at it.,"Hayley wanted to learn how to take a nap."" She had been attacked and raped before. She decided to attend self-defense classes. She ended up really loving it and being great at it."
44b8a224-f3f1-45c4-94cc-4a10fe3a46d0,1,He felt a tug on his line.,He felt a tug on his clothes.,"Ray was fishing in the ocean. He felt a tug on his line. He reeled it in, excited. But then he frowned in disappointment.","Ray was fishing in the ocean. He felt a tug on his clothes. He reeled it in, excited. But then he frowned in disappointment."
d0fb77d7-a959-4a8d-b718-c95f2cf85c7c,1,This year James is invited to take guitar lessons after school.,This year James is not invited to take guitar lessons after school.,James has played baseball for eight years. This year James is invited to take guitar lessons after school. Guitar lessons are on the same day as baseball practice. James chooses not to play baseball this year.,James has played baseball for eight years. This year James is not invited to take guitar lessons after school. Guitar lessons are on the same day as baseball practice. James chooses not to play baseball this year.
7e7426e5-59ca-4114-bf0d-3414bd4adcb9,2,She decided to get a cat to soothe her.,She decided to get a dog to soothe her.,China was so scared because the house had mice. She was out of options and didn't know what to do. She decided to get a cat to soothe her. The cat immediately got the mice and killed them.,China was so scared because the house had mice. She was out of options and didn't know what to do. She decided to get a dog to soothe her. The cat immediately got the mice and killed them.
3481e191-6645-47b6-92c4-eccc9f3b2b7b,2,She decided to get a job and save all her money.,"""She decided to get a job and spend all her money.""","Colleen really wanted her own car. Her parents would let her use theirs, but she wanted her own. She decided to get a job and save all her money. It took many months, but she eventually saved enough.","Colleen really wanted her own car. Her parents would let her use theirs, but she wanted her own. ""She decided to get a job and spend all her money."" It took many months, but she eventually saved enough."
4ec9c3a1-bdf9-4824-a26e-952cd813d2a8,1,I found a stray dog with a collar.,"I found a stray dog with a collar.""",I was walking through Central Park on a fall day. I found a stray dog with a collar. I called the number on the collar and talked to the owners. The owners came to the park to pick up their dog.,"I was walking through Central Park on a fall day. I found a stray dog with a collar."" I called the number on the collar and talked to the owners. The owners came to the park to pick up their dog."
f0dc2cf1-352d-43e8-91d2-2ca6a4c9f67b,0,Hallie had just turned ten years old.,Hallie had just turned ten years old.,"Hallie had just turned ten years old. Her mother thought it was appropriate for ear piercing. Hallie put her hands together, she was so excited. She sat down and got them done.","Hallie had just turned ten years old. Her mother thought it was appropriate for ear piercing. Hallie put her hands together, she was so excited. She sat down and got them done."
d81af094-1ae6-4b68-8f24-26ea58286561,0,Jane's mom was pregnant with her second child.,Jane's mom was ill with her second child.,Jane's mom was pregnant with her second child. She went to the hospital. She delivered the baby. Jane went to go see the new baby.,Jane's mom was ill with her second child. She went to the hospital. She delivered the baby. Jane went to go see the new baby.
a618907c-28ee-4785-83e3-4632439da22b,1,There was a poster of the cool new girl group.,The poster was not of the cool new girl group.,Gina was putting posters on her bedroom walls. There was a poster of the cool new girl group. The girls were wearing bright colored clothing. Gina herself was wearing a brown shirt and khakis.,Gina was putting posters on her bedroom walls. The poster was not of the cool new girl group. The girls were wearing bright colored clothing. Gina herself was wearing a brown shirt and khakis.
635302e9-0336-4291-a597-94588eaa9330,0,Hannah always wanted to go to Italy.,Hannah always wanted to go to New York.,Hannah always wanted to go to Italy. She had been saving money for years. Hannah decided she wanted to go as part of a group. She went to see a travel agent to help her plan.,Hannah always wanted to go to New York. She had been saving money for years. Hannah decided she wanted to go as part of a group. She went to see a travel agent to help her plan.
ac7f06b2-88a4-4b4e-bdb5-eae9446c5bdc,2,"In the kitchen, there was a beer can on the counter.","In the kitchen, there was a beer can on the counter.""","Gina was at her uncle's house out of state. Her parents were in the living room playing music. In the kitchen, there was a beer can on the counter. She thought about taking a sip.","Gina was at her uncle's house out of state. Her parents were in the living room playing music. In the kitchen, there was a beer can on the counter."" She thought about taking a sip."
882b2f88-f545-437d-8977-76c4b8edcc0e,2,I took him to a security guard.,"""I sent him to a security guard.""",I found a puppy at the mall. He looked very sad and lonely. I took him to a security guard. The security guard told me he could not help.,"I found a puppy at the mall. He looked very sad and lonely. ""I sent him to a security guard."" The security guard told me he could not help."
efdc65c3-988e-42a2-b320-9f0d8c71456a,1,They bought her a pony for her birthday and put a unicorn horn strap on it.,She broke the unicorn's horn on her pony.,"Hayden's parents knew she loved unicorns. They bought her a pony for her birthday and put a unicorn horn strap on it. Hayden was so excited, she jumped for joy and thanked her parents. She hugged the unicorn then brushed its mane.","Hayden's parents knew she loved unicorns. She broke the unicorn's horn on her pony. Hayden was so excited, she jumped for joy and thanked her parents. She hugged the unicorn then brushed its mane."
01014fb8-aa61-4843-9064-88c2c33ac40e,0,"I and my girlfriend went to Buffalo, New York.","""I and my gf went to Montreal, Canada.""","I and my girlfriend went to Buffalo, New York. We then got to experience Niagara Falls. We walked around a lot then went on a boat. I took a lot of photographs.","""I and my gf went to Montreal, Canada."" We then got to experience Niagara Falls. We walked around a lot then went on a boat. I took a lot of photographs."
9bb0e922-bcf9-4911-b356-b9e03fdbc618,0,"When Ann got to school, she realized her homework was on the bus.","When Ann got to school, she forgot her homework was on the bus.","When Ann got to school, she realized her homework was on the bus. She could do nothing to get it back. She explained to her teachers about her mistake. All of them believed her and said she could turn it in a day late.","When Ann got to school, she forgot her homework was on the bus. She could do nothing to get it back. She explained to her teachers about her mistake. All of them believed her and said she could turn it in a day late."
3bb9cbfa-b976-4f8a-8e40-70ab9638d28f,1,He decided to drive two hours to his favorite restaurant.,He decided to drive two hours to his favorite restaurant.,Ronny only ate pasta from a particular restaurant. He decided to drive two hours to his favorite restaurant. He arrived and the restaurant was closing. The restaurant owner decided to serve him a meal he just whipped up for himself.,Ronny only ate pasta from a particular restaurant. He decided to drive two hours to his favorite restaurant. He arrived and the restaurant was closing. The restaurant owner decided to serve him a meal he just whipped up for himself.
897de7e5-3310-41d8-b663-8998fabd2656,1,I tried to get him to eat kale but he didn't like it.,""" I tried to get him to eat kale but he didn't like it "".",My boyfriend is a picky eater. I tried to get him to eat kale but he didn't like it. I tried to get him to eat spaghetti but he still did not like it. I finally decided to give him pizza.,"My boyfriend is a picky eater. "" I tried to get him to eat kale but he didn't like it "". I tried to get him to eat spaghetti but he still did not like it. I finally decided to give him pizza."
1aabb257-5f49-4beb-bde4-1e21d7856153,0,Rachel found out that she had cancer.,Rachel found out that she never had cancer.,Rachel found out that she had cancer. She was very scared. Rachel told her family and it was very difficult. They all cried.,Rachel found out that she never had cancer. She was very scared. Rachel told her family and it was very difficult. They all cried.
a91c4bf8-4493-4f11-86f0-c828ffe74acb,0,"Yesterday, I went to my favorite place to buy groceries.","Yesterday, I went to my favorite place to buy the groceries.","Yesterday, I went to my favorite place to buy groceries. I decided to go in the afternoon in my car. I usually buy the same things, but today I bought some fresh steaks. I couldn't wait to get home and grill them for dinner in the evening.","Yesterday, I went to my favorite place to buy the groceries. I decided to go in the afternoon in my car. I usually buy the same things, but today I bought some fresh steaks. I couldn't wait to get home and grill them for dinner in the evening."
5a599bbe-3c46-4300-a310-7f03681914e4,2,They packed up the car and headed out for the beach.,They packed up the car and ended up on their way to the beach .,Ted and Wanda were excited about taking a trip. They were only able to go for the day so they had to leave early. They packed up the car and headed out for the beach. They spent all day having a great time on the beach.,Ted and Wanda were excited about taking a trip. They were only able to go for the day so they had to leave early. They packed up the car and ended up on their way to the beach . They spent all day having a great time on the beach.
d04a7411-1f20-44c6-9570-6448cf495be4,0,Bob saw a plate filled with bacon.,Bob saw a plate filled with broccoli.,Bob saw a plate filled with bacon. He started to get hungry. He ate one piece of bacon. Then he ate a second piece.,Bob saw a plate filled with broccoli. He started to get hungry. He ate one piece of bacon. Then he ate a second piece.
3a0f9fd7-fcf8-4cc9-b5ca-79a176198a79,0,Ben has always wanted to learn how to play the piano.,Ben has always wanted to learn how to play the piano.,"Ben has always wanted to learn how to play the piano. Now that his children are grown up, he has more spare time. Ben enrolls in a piano class with a local tutor. Although it is difficult, he is dedicated to learning.","Ben has always wanted to learn how to play the piano. Now that his children are grown up, he has more spare time. Ben enrolls in a piano class with a local tutor. Although it is difficult, he is dedicated to learning."
cd5a5c96-9bcc-4981-b99f-ee9fd2628513,2,He began applying for new jobs and traveling to new cities.,"""He never applied for any new jobs and traveled to new cities.""","Tim was ready to move out of town at any cost. His current city felt stale and he felt trapped. He began applying for new jobs and traveling to new cities. He found a great job in Austin, Texas.","Tim was ready to move out of town at any cost. His current city felt stale and he felt trapped. ""He never applied for any new jobs and traveled to new cities."" He found a great job in Austin, Texas."
cddb63c3-9407-46eb-9321-a26396239718,1,She bought all the ingredients.,""" She devoured all the ingredients .",Lori found a new recipe. She bought all the ingredients. She followed the recipe perfectly. The dinner turned out well.,"Lori found a new recipe. "" She devoured all the ingredients . She followed the recipe perfectly. The dinner turned out well."
a55c4d97-f364-4152-803f-c45506f3dd48,1,"Yesterday, they brought their dog Kyle to the park with them.","Yesterday, they brought their dog Luke to the park with them.","Ryan and Sam like to go to the park together. Yesterday, they brought their dog Kyle to the park with them. When they got there, they saw another dog running around. That dog had no leash on!","Ryan and Sam like to go to the park together. Yesterday, they brought their dog Luke to the park with them. When they got there, they saw another dog running around. That dog had no leash on!"
28565664-1efa-44de-ba13-bc527cd2c46d,1,She decided to look at the available gyms and memberships in her town.,"""She decided not to look at the available gyms and memberships in her town.""","Kristie decided she was tired of being overweight. She decided to look at the available gyms and memberships in her town. She found a gym she liked, enrolled in a yoga class to start, and went to the gym at least five times a week. She weighed herself after a month.","Kristie decided she was tired of being overweight. ""She decided not to look at the available gyms and memberships in her town."" She found a gym she liked, enrolled in a yoga class to start, and went to the gym at least five times a week. She weighed herself after a month."
