InputStoryid,DistortedSentenceIndex,Original_Sentence,Distorted_Sentence,Original_Story,Distorted_Story
338f731f-b767-4858-b4d3-557cc69c8f02,0,An office worker booted up her computer.,An office worker wiped her computer.,"An office worker booted up her computer. She intended to do her quarterly reports. No matter how much she clicked, though, she could not open programs. Despair settled over her like a pea-soup fog of misery.","An office worker wiped her computer. She intended to do her quarterly reports. No matter how much she clicked, though, she could not open programs. Despair settled over her like a pea-soup fog of misery."
91f9a076-ebed-41ec-b32c-c556975ce156,2,So they filed a complaint.,"So they filed a complaint.""","John was a terrible boss. The workers decided to depose him. So they filed a complaint. Despite the complaint and following lawsuit, John stayed.","John was a terrible boss. The workers decided to depose him. So they filed a complaint."" Despite the complaint and following lawsuit, John stayed."
0e07687e-4284-4860-a614-66ad5e695d8d,0,Doreen loved orange flavored ice cream.,Doreen hated orange flavored ice cream.,Doreen loved orange flavored ice cream. One day when she was playing Doreen fell. She broke her leg and was crying a lot. Doreen's mom wanted to make her feel better.,Doreen hated orange flavored ice cream. One day when she was playing Doreen fell. She broke her leg and was crying a lot. Doreen's mom wanted to make her feel better.
b0e31a92-47d7-4063-9ae1-dab4be5fc951,0,Drew orders a small ice cream cone at the Drive Thru.,"""Drew eats a small ice cream cone at the drive thru. """,Drew orders a small ice cream cone at the Drive Thru. He drove to the front window to wait for his order. The cashier handed the ice cream with one of her hands. Drew took the ice cream cone and turned it upside down.,"""Drew eats a small ice cream cone at the drive thru. "" He drove to the front window to wait for his order. The cashier handed the ice cream with one of her hands. Drew took the ice cream cone and turned it upside down."
d614c1d2-f75f-4e7f-b54f-8142968365ff,1,I had never been tackled before.,""" I have never been tackled before "".","It was my first time ever playing football and I was so nervous. I had never been tackled before. I hoped it would not hurt. During the game, I got tackled and it did not hurt at all!","It was my first time ever playing football and I was so nervous. "" I have never been tackled before "". I hoped it would not hurt. During the game, I got tackled and it did not hurt at all!"
acbcbc8b-d040-43c6-a5ea-4e6f5e08d10a,2,Dylan decided to do some extra cores and earn an allowance.,"""Dylan decided to do some extra chores and earn an allowance.""",Dylan wanted to buy a new video game. Dylan asked his mom so she said no. Dylan decided to do some extra cores and earn an allowance. Dylan worked hard and on Friday his mom gave him an allowance.,"Dylan wanted to buy a new video game. Dylan asked his mom so she said no. ""Dylan decided to do some extra chores and earn an allowance."" Dylan worked hard and on Friday his mom gave him an allowance."
967246a3-7376-446c-b950-1df5d00735e7,1,We decided to have a party for her and her friends at an art studio.,We decided to have a party for her and her friends at a beach.,My daughter was celebrating her sixth birthday. We decided to have a party for her and her friends at an art studio. All her friends arrived and waited for the instructions. Each friend listened to directions on how to paint their picture.,My daughter was celebrating her sixth birthday. We decided to have a party for her and her friends at a beach. All her friends arrived and waited for the instructions. Each friend listened to directions on how to paint their picture.
396d6e1b-7e50-4f5b-8628-4fbb2bebddd9,2,He suggested probiotics and active cultures.,""" He suggested probiotics and active cultures.""",Em had had digestion issues lately. She visited her doctor. He suggested probiotics and active cultures. Em started to eat enriched yogurt every day.,"Em had had digestion issues lately. She visited her doctor. "" He suggested probiotics and active cultures."" Em started to eat enriched yogurt every day."
eb35f7a7-b9e2-4504-8382-5e6e013219d7,0,Eric was having a picnic in the park with his girlfriend.,Eric was missing his girlfriend on the picnic.,"Eric was having a picnic in the park with his girlfriend. Eric was eating a sandwich and enjoying the weather. All of a sudden, a pigeons swooped down and snagged his sandwich. Eric quickly chased after the pigeon.","Eric was missing his girlfriend on the picnic. Eric was eating a sandwich and enjoying the weather. All of a sudden, a pigeons swooped down and snagged his sandwich. Eric quickly chased after the pigeon."
4e779ed6-97b3-4166-9772-b81941100885,0,Ethan enrolled in a singing lesson near his house.,Ethan had enrolled in a singing lesson near his house.,Ethan enrolled in a singing lesson near his house. He did not have any previous experience and was nervous. His instructor was a nice lady who was a world renown singer. Ethan practiced singing the scales with her.,Ethan had enrolled in a singing lesson near his house. He did not have any previous experience and was nervous. His instructor was a nice lady who was a world renown singer. Ethan practiced singing the scales with her.
1da90fe0-e9b0-4a8d-b10c-bae2f9479e81,1,He looked through the whole aisle but could not decide on a fruit.,""" He looked through the whole aisle but could not decide on a fruit .""","Bryan was shopping for fruit for his family. He looked through the whole aisle but could not decide on a fruit. His wife hated grapes, his daughter hated apples. Even his son was a fussy fruit eater!","Bryan was shopping for fruit for his family. "" He looked through the whole aisle but could not decide on a fruit ."" His wife hated grapes, his daughter hated apples. Even his son was a fussy fruit eater!"
9721f536-77ab-4f22-a616-a34b69129494,1,They are comfortable and light.,"""They are cold and light.""",I just bought new shoes to workout in. They are comfortable and light. They were on sale. I like them because they are made with aerodynamic properties to enhance your speed.,"I just bought new shoes to workout in. ""They are cold and light."" They were on sale. I like them because they are made with aerodynamic properties to enhance your speed."
2e10d09b-d8ec-4c12-8468-dab5a4faf231,1,He offered a couple of drinks.,He refused a couple of drinks.,"Lance was trying to pick up girls at the club. He offered a couple of drinks. Only one agreed but didn't pursue it further. Eventually, he got drunk and frustrated.","Lance was trying to pick up girls at the club. He refused a couple of drinks. Only one agreed but didn't pursue it further. Eventually, he got drunk and frustrated."
7ed5888c-7e5d-4066-a9b0-c48931fa40fe,1,He especially liked remixing other people's work.,"""He especially hated remixing other people's work.""","Larry loved making music. He especially liked remixing other people's work. He would upload his stuff to YouTube. Eventually, he was sued by too many other artists.","Larry loved making music. ""He especially hated remixing other people's work."" He would upload his stuff to YouTube. Eventually, he was sued by too many other artists."
133e5997-5440-4cbe-84a8-50c8c973c5ec,0,Barbara had a problem with her ex-boyfriend.,Barbara had a problem with her ex-girlfriend.,"Barbara had a problem with her ex-boyfriend. Sometimes he would come by her house asking for a date. She would tell him, no but he still continued to do it. Eventually, her boyfriend got fed up and told him off.","Barbara had a problem with her ex-girlfriend. Sometimes he would come by her house asking for a date. She would tell him, no but he still continued to do it. Eventually, her boyfriend got fed up and told him off."
6375e3bd-a663-46b8-994e-b7984b228b17,1,The cigarette but was still lit and fell on the floor.,"""The cigarette but was still lit and fell on the floor.""","Arthur fell asleep while smoking one night. The cigarette but was still lit and fell on the floor. It rolled to the curtains and caught them on fire. Eventually, his whole house burned down.","Arthur fell asleep while smoking one night. ""The cigarette but was still lit and fell on the floor."" It rolled to the curtains and caught them on fire. Eventually, his whole house burned down."
8c268972-768e-45e6-a69f-0a4249adb323,0,My old job kept asking too much of me.,"""My old job kept asking too little of me.""","My old job kept asking too much of me. Every Wednesday there was a ton of new work. I could never catch up and each week got worse. Eventually, I got too far behind and had to quit.","""My old job kept asking too little of me."" Every Wednesday there was a ton of new work. I could never catch up and each week got worse. Eventually, I got too far behind and had to quit."
3e295dd9-eb51-4b6b-88af-bbc39209f9a5,0,My Netflix keeps buffering last night.,"""My Netflix always keeps buffering last night.""","My Netflix keeps buffering last night. Even if I paused it nothing would happen. It would just play for a second and buffer. Eventually, I reset the router.","""My Netflix always keeps buffering last night."" Even if I paused it nothing would happen. It would just play for a second and buffer. Eventually, I reset the router."
d99e110d-caf2-4624-b081-b145480dc3cf,1,He goes to his doctor and learns that he has a rash.,""" He goes to his doctor and learns that he has a rash .""","Archibald notices that his skin is red and inflamed. He goes to his doctor and learns that he has a rash. He applies ointment every day to soothe the rash. Eventually, the rash begins to go away.","Archibald notices that his skin is red and inflamed. "" He goes to his doctor and learns that he has a rash ."" He applies ointment every day to soothe the rash. Eventually, the rash begins to go away."
df4f9d86-a055-4ebd-8f6c-c02cfed3b5fa,0,Nate was going to buy a new car.,Nate was going to buy a used car.,"Nate was going to buy a new car. He went to a dealership last week. Nate spent hours there, haggling with several different salespeople. Eventually, he just gave up.","Nate was going to buy a used car. He went to a dealership last week. Nate spent hours there, haggling with several different salespeople. Eventually, he just gave up."
383ba2cb-f39d-479e-b432-374595548852,0,Jake used to feed the squirrels that came to his yard.,Jake used to hate squirrels that came to his yard.,"Jake used to feed the squirrels that came to his yard. He was pretty sure that he could tell them apart. To test this, he used to give one squirrel more food than the others. Eventually, he was able to identify which one it was.","Jake used to hate squirrels that came to his yard. He was pretty sure that he could tell them apart. To test this, he used to give one squirrel more food than the others. Eventually, he was able to identify which one it was."
38e9a7f3-c1fa-4a9f-8e0b-274eead8b82d,0,Betsy and her little brother were playing cards.,"""Betsy and her little sister were playing cards.""","Betsy and her little brother were playing cards. Her little brother insisted on shuffling. He had never done it before. Every time he did it, cards went flying everywhere.","""Betsy and her little sister were playing cards."" Her little brother insisted on shuffling. He had never done it before. Every time he did it, cards went flying everywhere."
a3df2ea1-8ef4-463d-a1e5-3bc0382a0f1a,0,The band walked to the front of the stage.,The band walked away from the stage.,The band walked to the front of the stage. They began to perform. The electricity immediately went off. Everyone couldn't see where they were.,The band walked away from the stage. They began to perform. The electricity immediately went off. Everyone couldn't see where they were.
352b9aef-f378-472b-8663-cbc3d99fe37d,0,Steve decides to have an Easter egg hunt at his house this weekend.,Steve decides to have a Christmas egg hunt at his house this weekend.,"Steve decides to have an Easter egg hunt at his house this weekend. He buys a dozen eggs, colors them, and hides them in his yard. Steve announces the hunt to all of his friends with kids. Everyone has a great time at Steve's Easter egg hunt.","Steve decides to have a Christmas egg hunt at his house this weekend. He buys a dozen eggs, colors them, and hides them in his yard. Steve announces the hunt to all of his friends with kids. Everyone has a great time at Steve's Easter egg hunt."
99416a3f-356e-4dcb-b74c-f685e85677dc,0,Karen was a softball player.,Karen was a baseball player.,Karen was a softball player. Her team wasn't doing very well. Her coach gave them a very inspiring speech. Everyone started to practice and work much harder.,Karen was a baseball player. Her team wasn't doing very well. Her coach gave them a very inspiring speech. Everyone started to practice and work much harder.
e645d6bf-b177-4b90-a535-a69a45825819,1,He always made sure they wore their seatbelts.,He always made sure they didn't wear their seatbelts.,Jay didn't mind driving for his friends. He always made sure they wore their seatbelts. Yesterday he got into an accident. Everyone was safe even if they were hurt.,Jay didn't mind driving for his friends. He always made sure they didn't wear their seatbelts. Yesterday he got into an accident. Everyone was safe even if they were hurt.
7eb697d1-9e2a-4673-acab-828676b5a925,0,Felipe had always wanted to try making grits but hadn't tried.,"""Felipe had always wanted to try making grits but hadn't tried.""","Felipe had always wanted to try making grits but hadn't tried. Finally, he asked his friend Jasper to help him cook grits one day. They followed each step of the recipe closely. Felipe tried the grits and they were delicious.","""Felipe had always wanted to try making grits but hadn't tried."" Finally, he asked his friend Jasper to help him cook grits one day. They followed each step of the recipe closely. Felipe tried the grits and they were delicious."
4d7557d6-3c71-46f2-a22a-3ec489270cf7,1,The ice in the driveway prevented her from moving the car.,The ice in the driveway kept her from driving the car.,"Kathy needed to get to work. The ice in the driveway prevented her from moving the car. She tried putting salt, and sand but nothing helped. Finally, a neighbor came by to help.","Kathy needed to get to work. The ice in the driveway kept her from driving the car. She tried putting salt, and sand but nothing helped. Finally, a neighbor came by to help."
3e566650-3bbd-4494-9458-9ee7ad7deca2,1,He really wanted to shave.,He really could not shave.,"Joey was fourteen. He really wanted to shave. He watched his face every week in the mirror. Finally, he began to grow a beard.","Joey was fourteen. He really could not shave. He watched his face every week in the mirror. Finally, he began to grow a beard."
2543dc0a-fd4f-4a68-9723-2d15f059a216,0,Clayton wants a car so that he can feel more independent.,Clayton does not want a car so that he can feel more independent.,"Clayton wants a car so that he can feel more independent. He begins saving more money from his job at the library. Clayton researches different car types. Finally, he decides to buy a small sedan.","Clayton does not want a car so that he can feel more independent. He begins saving more money from his job at the library. Clayton researches different car types. Finally, he decides to buy a small sedan."
59e29798-9595-4e70-90b5-ae26952ae30d,2,He enrolled in a cello course and practiced each night.,"He enrolled in a cello course and stopped practicing each night.""","Rufus had always loved the soothing sounds of a cello playing. He resolved that he would learn cello one day. He enrolled in a cello course and practiced each night. Finally, he was an expert at the cello.","Rufus had always loved the soothing sounds of a cello playing. He resolved that he would learn cello one day. He enrolled in a cello course and stopped practicing each night."" Finally, he was an expert at the cello."
d463b311-2c1a-47b8-bce0-ca5e15613436,0,When Al let his cat out last week there was a squirrel running by.,"When Al let his cat out last week there was no squirrel running by.""","When Al let his cat out last week there was a squirrel running by. The cat immediately ran after it. It chased it up a tree. Finally, it actually caught it and killed it.","When Al let his cat out last week there was no squirrel running by."" The cat immediately ran after it. It chased it up a tree. Finally, it actually caught it and killed it."
02b3f429-645b-4747-804f-57ec2731bb98,0,His first time at the opera.,His first time at the opera.,"His first time at the opera. He only went after his girlfriend begged. He sat for three hours in sheer boredom. Finally, it was over.","His first time at the opera. He only went after his girlfriend begged. He sat for three hours in sheer boredom. Finally, it was over."
b29cb375-9c60-4f5d-85a7-b135bb281792,1,She got a new job so it's hard to talk.,She got a new job so it's easy to talk.,"I hadn't seen my girlfriend in a while. She got a new job so it's hard to talk. The job takes up all of her time. Finally, she called me to hang out.","I hadn't seen my girlfriend in a while. She got a new job so it's easy to talk. The job takes up all of her time. Finally, she called me to hang out."
94cb01ae-1df5-4606-951a-4a73deb36567,1,Her pigtails were always lopsided!,"""Her pigtails are always sloppy!""","Ky was doing her hair. Her pigtails were always lopsided! She just couldn't get them straight. Finally, she gave up and went to school with lopsided pigtails.","Ky was doing her hair. ""Her pigtails are always sloppy!"" She just couldn't get them straight. Finally, she gave up and went to school with lopsided pigtails."
60a6133e-5a7e-4702-9a09-0b2efe37cef5,0,Pam tried to trim Archie's claws.,Pam didn't want to trim Archie's claws.,"Pam tried to trim Archie's claws. She tried holding him all different ways. He didn't want them clipped at all! Finally, she thought of something that would work.","Pam didn't want to trim Archie's claws. She tried holding him all different ways. He didn't want them clipped at all! Finally, she thought of something that would work."
b88eaa16-bb24-4026-9561-5875ed771778,1,She has the apples but they need to be peeled.,"""She has the apples, but they need to be peeled.""","Angelina wants to make an apple pie. She has the apples but they need to be peeled. She starts peeling. Finally, they are all peeled.","Angelina wants to make an apple pie. ""She has the apples, but they need to be peeled."" She starts peeling. Finally, they are all peeled."
bfe47075-d94e-4532-9016-87dfe9948948,0,Chase and his girlfriend got into a fight.,Chase and his girlfriend got into a fight.,"Chase and his girlfriend got into a fight. They went to bed mad. In the morning they sat and talked. Finally, they made up and hugged.","Chase and his girlfriend got into a fight. They went to bed mad. In the morning they sat and talked. Finally, they made up and hugged."
88c26e0e-a5d1-4aeb-8647-51cd931eecfe,1,He was quite excited.,He was quite shocked.,"Today was the day Fred was getting his exam back. He was quite excited. But at the same time, he was nervous. Finally, when he got it back he saw that he aced it.","Today was the day Fred was getting his exam back. He was quite shocked. But at the same time, he was nervous. Finally, when he got it back he saw that he aced it."
27a9d53b-c9fa-4e6c-8198-1f750b1cb7e1,1,He wanted to spend a lot of time enjoying it.,"""He didn't want to spend a lot of time enjoying it.""","Pete got a new video game for his computer. He wanted to spend a lot of time enjoying it. However, his work and other responsibilities gave him no time. Finally, he chose to make time and set aside one weekend for himself.","Pete got a new video game for his computer. ""He didn't want to spend a lot of time enjoying it."" However, his work and other responsibilities gave him no time. Finally, he chose to make time and set aside one weekend for himself."
986afb35-f724-49f2-a76c-621e0ec65e78,1,He had already sent an email to the network.,He had not sent an email to the network.,"Jordan was upset that his favorite show was being canceled. He had already sent an email to the network. When that netted no results, he posted on forums. Finally, he realized there was no hope.","Jordan was upset that his favorite show was being canceled. He had not sent an email to the network. When that netted no results, he posted on forums. Finally, he realized there was no hope."
12de72df-7d14-4652-8c16-39b4346e03ee,0,Kim and Rob wanted a pet.,Kim and Rob hated pets.,"Kim and Rob wanted a pet. They decided to visit the local Humane Society. They saw a lot of cute dogs. Finally, Kim found a small gray dog.","Kim and Rob hated pets. They decided to visit the local Humane Society. They saw a lot of cute dogs. Finally, Kim found a small gray dog."
f8559128-5ea3-4e26-9341-3d4a2e520495,1,"She talked to her friends, and she talked to her parents.","""She talked to her friends, and she talked to her parents.""","Pam was in love with Josh but she didn't know how to get his attention. She talked to her friends, and she talked to her parents. They all offered advice that didn't quite work for her. Finally, she just went up to him and told him her feelings.","Pam was in love with Josh but she didn't know how to get his attention. ""She talked to her friends, and she talked to her parents."" They all offered advice that didn't quite work for her. Finally, she just went up to him and told him her feelings."
466ec9c8-c36e-4130-ae1c-ff4890d407bb,0,Georgia was carving a pumpkin.,Georgia was not carving a pumpkin.,"Georgia was carving a pumpkin. First, she put it on the table, on top of some newspaper. Then, she cut the top off and scraped out all of the seeds. Finally, she used a large knife to carve a face in the pumpkin.","Georgia was not carving a pumpkin. First, she put it on the table, on top of some newspaper. Then, she cut the top off and scraped out all of the seeds. Finally, she used a large knife to carve a face in the pumpkin."
744e06eb-4c21-469d-869f-59858a6f94fc,2,"They made snowmen, snowballs, and sledding.","They made snow, snowballs and sledding.","The snow had finally finished falling. Bobby and his friends rushed outdoors to play in it. They made snowmen, snowballs, and sledding. Finally, they decided on an all-out snowball war.","The snow had finally finished falling. Bobby and his friends rushed outdoors to play in it. They made snow, snowballs and sledding. Finally, they decided on an all-out snowball war."
847c6577-a726-4b3b-8c75-1adb69082d3e,1,"Unfortunately, when they got older, they began to fight.","""Unfortunately, when they got younger, they began to fight.""","Alfred and Arthur had been best friends when they were children. Unfortunately, when they got older, they began to fight. They stopped talking to each other for a few years. Finally, they managed to reconcile.","Alfred and Arthur had been best friends when they were children. ""Unfortunately, when they got younger, they began to fight."" They stopped talking to each other for a few years. Finally, they managed to reconcile."
306f8076-4bdf-4d4b-8ef6-99b48a7f16f9,2,She has different cute ones.,She has different ugly ones.,"My girlfriend collects stamps. Not the kind for mail but the kind to stamp things with. She has different cute ones. For her birthday, I want to buy her more.","My girlfriend collects stamps. Not the kind for mail but the kind to stamp things with. She has different ugly ones. For her birthday, I want to buy her more."
b9ba0a42-44e9-4419-81cc-d83396d6a2fe,0,Gina's dad was near the kitchen window outside.,Gina's dad was nearby the kitchen window inside.,Gina's dad was near the kitchen window outside. Her mother sprayed him through the window with the sink sprayer. Soon they were throwing cups of water at each other in the yard. Gina and her siblings joined as well.,Gina's dad was nearby the kitchen window inside. Her mother sprayed him through the window with the sink sprayer. Soon they were throwing cups of water at each other in the yard. Gina and her siblings joined as well.
77c0973d-654a-45f6-b7f3-ce11ff9d18f8,0,Gina went to the bathroom at her grandma's house.,"Gina stayed at home and made supper.""","Gina went to the bathroom at her grandma's house. On the way, she passed the kitchen. On the table were the remains of a mincemeat pie. Gina hadn't had mincemeat pie in ten Years.","Gina stayed at home and made supper."" On the way, she passed the kitchen. On the table were the remains of a mincemeat pie. Gina hadn't had mincemeat pie in ten Years."
d0211622-766b-4eb4-98da-3c4303224934,1,Last time she replaced it without her parents knowing.,""" Last time she had it without her parents knowing "".",Gina lost her key for the second time in eight months. Last time she replaced it without her parents knowing. But she had no money to buy a new one now. Gina knew her parents would be upset.,"Gina lost her key for the second time in eight months. "" Last time she had it without her parents knowing "". But she had no money to buy a new one now. Gina knew her parents would be upset."
a5781987-d112-414a-828d-b6c484290842,1,"In the yard, her dad and his friends were fighting.","In the yard, her dad and his friends were jogging.","Gina and her siblings were in the house looking out the window. In the yard, her dad and his friends were fighting. The fight was violent and scary. Gina shooed the kids away from the windows.","Gina and her siblings were in the house looking out the window. In the yard, her dad and his friends were jogging. The fight was violent and scary. Gina shooed the kids away from the windows."
