InputStoryid,DistortedSentenceIndex,Original_Sentence,Distorted_Sentence,Original_Story,Distorted_Story
71b81455-9450-4317-b505-92388523bccf,0,Rachel was looking at her daily mail.,Rachel was looking at her daily mail.,Rachel was looking at her daily mail. She found a letter written in a foreign language. Rachel showed the letter to her friends. No one could read or understand the letter.,Rachel was looking at her daily mail. She found a letter written in a foreign language. Rachel showed the letter to her friends. No one could read or understand the letter.
27a61124-9474-4591-a47d-351daabbb485,1,He decides that he needs to trim it.,"""He decides that he needs to shave it "".",Ralph's beard has become messy and long. He decides that he needs to trim it. He carefully cuts his beard until it is neat and trim. Now Ralph looks much less disheveled.,"Ralph's beard has become messy and long. ""He decides that he needs to shave it "". He carefully cuts his beard until it is neat and trim. Now Ralph looks much less disheveled."
177311b7-10c0-4fee-90d8-373f4995aaf9,2,They arrived at the place but saw that it had closed.,"""They arrived at the place, but saw that it had just opened.""","Rachel wanted to take her husband out to dinner. She had the perfect place in mind, her favorite Chinese restaurant. They arrived at the place but saw that it had closed. On a paper on the door, she saw that they had moved out of town.","Rachel wanted to take her husband out to dinner. She had the perfect place in mind, her favorite Chinese restaurant. ""They arrived at the place, but saw that it had just opened."" On a paper on the door, she saw that they had moved out of town."
0fd437e4-2184-4732-aeb0-4be6f14c1932,1,He studied the part carefully.,""" He studied the letter carefully "".","Bob wanted to be in the school play. He studied the part carefully. He rehearsed his lines often. On audition day, he did a great job.","Bob wanted to be in the school play. "" He studied the letter carefully "". He rehearsed his lines often. On audition day, he did a great job."
c1e95a23-4e0c-48d1-8c09-70a5861ef253,2,Andy had swerved away from an oncoming vehicle and into a trolley.,Andy had driven away from an oncoming vehicle and into a trolley.,"Naomi and Andy were riding their bikes in downtown SF. Naomi heard a loud crash and turned around to look at Andy. Andy had swerved away from an oncoming vehicle and into a trolley. On impact, Andy was flung over his handlebars and landed on his wrist.","Naomi and Andy were riding their bikes in downtown SF. Naomi heard a loud crash and turned around to look at Andy. Andy had driven away from an oncoming vehicle and into a trolley. On impact, Andy was flung over his handlebars and landed on his wrist."
e92455e4-44b5-41e1-9085-05c4643caed5,2,"After the third day, he found one he was interested in.",""" After the third day, he found one he was uninterested in.""","Dan made up his mind that he would buy a boat by the end of the week. He spent the first few days checking out the closest dealerships. After the third day, he found one he was interested in. On the fourth day, he went to his bank to get a loan.","Dan made up his mind that he would buy a boat by the end of the week. He spent the first few days checking out the closest dealerships. "" After the third day, he found one he was uninterested in."" On the fourth day, he went to his bank to get a loan."
53d52b0c-faaf-4f75-8c60-6419cd76e865,0,Emily was a little girl when her father passed away.,Emily was a little girl when her father died.,"Emily was a little girl when her father passed away. Her mother raised her all on her own. When Emily was nineteen years old her mother went on a trip. On the way to her vacation, her mom was in a plane crash.","Emily was a little girl when her father died. Her mother raised her all on her own. When Emily was nineteen years old her mother went on a trip. On the way to her vacation, her mom was in a plane crash."
ef015271-4f5c-4765-90bb-4ba367df3782,0,"Newly married, Sue liked to cook for her husband.","Newly divorced, Sue liked to cook for her husband.","Newly married, Sue liked to cook for her husband. Unfortunately, Sue was a terrible cook. Bob ate her food anyway and told her it was good. On their first anniversary, Bob gave Sue cooking lessons.","Newly divorced, Sue liked to cook for her husband. Unfortunately, Sue was a terrible cook. Bob ate her food anyway and told her it was good. On their first anniversary, Bob gave Sue cooking lessons."
3dcef1d5-c9a3-4417-95c4-01245b9b8709,0,I stayed in the library all night to study for a chemistry test.,"""I stayed at the bar all night to have a grog with my husband.""","I stayed in the library all night to study for a chemistry test. By the time the sun started to come up, I was exhausted. I struggled to keep my eyes open as I walked to class. Once the tests were handed out, I immediately fell asleep.","""I stayed at the bar all night to have a grog with my husband."" By the time the sun started to come up, I was exhausted. I struggled to keep my eyes open as I walked to class. Once the tests were handed out, I immediately fell asleep."
c0adfe4d-8efc-4818-b900-2edbbe2ac7ad,0,We went on Tower of Terror while at Disney.,"""We didn't go on Tower of Terror while at Disney.""",We went on Tower of Terror while at Disney. My wife decided to go on even though she hates rides. She was so nervous the whole time in line. Once we got on the ride the panic started.,"""We didn't go on Tower of Terror while at Disney."" My wife decided to go on even though she hates rides. She was so nervous the whole time in line. Once we got on the ride the panic started."
d7161dfc-2696-4a85-96fd-ac0772adafb4,1,He joined a band as lead vocalist.,He left a band as the lead singer.,Ross had big dreams to be a professional singer. He joined a band as lead vocalist. He took voice lessons. One day his band tried out for a talent competition.,Ross had big dreams to be a professional singer. He left a band as the lead singer. He took voice lessons. One day his band tried out for a talent competition.
dff8ba4a-9e7f-4c1f-b52e-3b86957218a4,2,He used to make me pick out a belt so that he could whip me.,"He used to make me pick out a belt so that he could smack me.""",My mom remarried when I was five. She married an alcoholic who was physically and mentally abusive. He used to make me pick out a belt so that he could whip me. One day I grabbed the belt away from him as he was hitting me.,"My mom remarried when I was five. She married an alcoholic who was physically and mentally abusive. He used to make me pick out a belt so that he could smack me."" One day I grabbed the belt away from him as he was hitting me."
cedec08c-139c-44d0-8553-a1e400f5fde9,1,She visited Cold Stone and discovered they had cinnamon ice cream.,"She visited Cold Stone and discovered they had chili ice cream.""",Kay loved Ice Cream. She visited Cold Stone and discovered they had cinnamon ice cream. She ate cinnamon ice cream every week for three months. One day she returned and was told the ice cream was no longer sold.,"Kay loved Ice Cream. She visited Cold Stone and discovered they had chili ice cream."" She ate cinnamon ice cream every week for three months. One day she returned and was told the ice cream was no longer sold."
fa7a44a1-7fa7-4d6a-8a56-e6efbb1255d1,1,He ran to school and back.,He didn't run to school and back.,Jerry loved running everywhere. He ran to school and back. He ran to the store. One day there was a beautiful sunset.,Jerry loved running everywhere. He didn't run to school and back. He ran to the store. One day there was a beautiful sunset.
35c2397f-f6d9-4394-92b4-a9f196f991aa,2,He draws up his resume.,"""He gives up his resume.""","Craig just graduated high school and wants a job. He gets the daily newspaper and checks out the help wanted ads. He draws up his resume. One of the people, where he applies, calls him for an interview.","Craig just graduated high school and wants a job. He gets the daily newspaper and checks out the help wanted ads. ""He gives up his resume."" One of the people, where he applies, calls him for an interview."
812d025e-785f-4faa-b548-bc172180f35f,1,He put rose petals by the door.,""" He put roses by the door "".",Jerry wanted a romantic evening with his girlfriend. He put rose petals by the door. He lit candles throughout the apartment. One of them caught a curtain on fire.,"Jerry wanted a romantic evening with his girlfriend. "" He put roses by the door "". He lit candles throughout the apartment. One of them caught a curtain on fire."
a4de7cae-f0ef-4587-8540-2dee39a2f3ae,1,One of them brought out a basket and set the food out on the table.,"""One of them brought out a basket and set the food out on the table.""","The two elderly ladies chatted as they ate lunch in the park. One of them brought out a basket and set the food out on the table. They talked and ate happily until they began to argue about something. One of them threw a piece of cake at the other, starting a food fight.","The two elderly ladies chatted as they ate lunch in the park. ""One of them brought out a basket and set the food out on the table."" They talked and ate happily until they began to argue about something. One of them threw a piece of cake at the other, starting a food fight."
b29dca85-1adc-4775-a529-70f90e73044d,0,Bob has heard that yoga will help him reduce his stress.,Bob has been told that yoga will help him fight his stress.,"Bob has heard that yoga will help him reduce his stress. He decides to attend a beginners yoga class. However, he finds that the poses are difficult and uncomfortable. One pose even makes his backache.","Bob has been told that yoga will help him fight his stress. He decides to attend a beginners yoga class. However, he finds that the poses are difficult and uncomfortable. One pose even makes his backache."
3d3c96fd-1796-4476-9ca8-62412634f5a5,0,Kevin decided to take his girlfriend ice skating.,Kevin decided to take his girlfriend swimming.,Kevin decided to take his girlfriend ice skating. The two of them had so much fun at the rink. They held hands and skated around. One time they fell but got back up.,Kevin decided to take his girlfriend swimming. The two of them had so much fun at the rink. They held hands and skated around. One time they fell but got back up.
4501d516-76f7-48bd-8fd1-ae258562eb41,0,Last week was the big election.,"""Last week was the small election.""",Last week was the big election. A lot of people got together for election parties. My friends and I were no exception. Our favorite candidate lost by a lot.,"""Last week was the small election."" A lot of people got together for election parties. My friends and I were no exception. Our favorite candidate lost by a lot."
9874003d-610d-4caa-bd35-cf75e496f479,0,Sunny went with her family to a village.,Sunny went with her family to a county.,Sunny went with her family to a village. The village was hosting a swap meet. Her family found some great deals. Overall Sunny found the event boring.,Sunny went with her family to a county. The village was hosting a swap meet. Her family found some great deals. Overall Sunny found the event boring.
3f031b85-e2cd-4f98-be61-23b7be817bf3,0,Pam loves music.,"""Pam hates music.""",Pam loves music. She especially likes to collect vinyl records. She has over one hundred records. Pam is now going to the record store.,"""Pam hates music."" She especially likes to collect vinyl records. She has over one hundred records. Pam is now going to the record store."
9f87b879-3c32-4ba9-ac68-42b81bc266a9,0,Pam was looking for a house to buy.,Pam was looking for a house to sell.,"Pam was looking for a house to buy. After a few months of looking, she finally found a house she loved. However, it was a little too expensive. Pam tried to talk down the price and succeeded.","Pam was looking for a house to sell. After a few months of looking, she finally found a house she loved. However, it was a little too expensive. Pam tried to talk down the price and succeeded."
4b65a3cf-c3f7-461f-95b6-444544af03b5,1,He warned them to wear clothes that covered their neck and chest.,He told them to wear clothes that covered their neck and chest.,"Mike took his son Jon and daughter-in-law Pam to the shooting range. He warned them to wear clothes that covered their neck and chest. If they didn't, hot spent shell casings could fall into their collars. Pam's shirt didn't have a collar, so a bit of her chest was exposed.","Mike took his son Jon and daughter-in-law Pam to the shooting range. He told them to wear clothes that covered their neck and chest. If they didn't, hot spent shell casings could fall into their collars. Pam's shirt didn't have a collar, so a bit of her chest was exposed."
511d4d08-3def-4d62-aee3-b12df5bf0652,2,"One day, his computer stopped working.","""One day, his computer stopped working!""","Pat liked to spend time online. He downloaded many files without being careful. One day, his computer stopped working. Pat brought it to a computer technician, who told him he had a virus.","Pat liked to spend time online. He downloaded many files without being careful. ""One day, his computer stopped working!"" Pat brought it to a computer technician, who told him he had a virus."
d1cb34cf-4103-4382-bfa5-b25048b13d70,1,The other boys were playing rougher than he was used to.,The other boys were playing calmer than he was used to.,Pat was playing a pickup soccer game. The other boys were playing rougher than he was used to. One boy slide tackled Pat as he was going in for a goal. Pat landed on his wrist and felt a snap.,Pat was playing a pickup soccer game. The other boys were playing calmer than he was used to. One boy slide tackled Pat as he was going in for a goal. Pat landed on his wrist and felt a snap.
5146a57e-f674-4c54-820e-aa83419a4d9f,0,Ben was nervous to be going to the dance with Pat.,Ben was excited to be going to the dance with Pat.,Ben was nervous to be going to the dance with Pat. He bought a new suit just for the occasion. Ben drove his father's car to pick It up. Pat's father told Ben that Pat was ill and could not go to the dance.,Ben was excited to be going to the dance with Pat. He bought a new suit just for the occasion. Ben drove his father's car to pick It up. Pat's father told Ben that Pat was ill and could not go to the dance.
135ec213-84cc-4d0f-9899-b68c6433d5ae,0,Penny is from a tropical climate.,Penny is from a desert climate.,"Penny is from a tropical climate. She has never seen snow. For vacation, she decided to go skiing. Penny saw snow for the first time.","Penny is from a desert climate. She has never seen snow. For vacation, she decided to go skiing. Penny saw snow for the first time."
6dd3ddea-c8c6-4cdd-8826-b69859f2fc58,2,The movie was hysterical.,"""The movie was boring.""",My friend Andrea and I went to the movies last week. We got big buckets of popcorn and saw Magic Mike. The movie was hysterical. People in the theater were laughing and having a great time.,"My friend Andrea and I went to the movies last week. We got big buckets of popcorn and saw Magic Mike. ""The movie was boring."" People in the theater were laughing and having a great time."
239e6838-ba42-4c0a-bf2a-275e2b87eddf,1,I work from home as a freelance artist.,"""I work from home as a commissioned artist.""",I love my job more than anything in the world. I work from home as a freelance artist. I work in my sweatpants and get to draw and paint. People pay a lot of money for my art and I am high in demand.,"I love my job more than anything in the world. ""I work from home as a commissioned artist."" I work in my sweatpants and get to draw and paint. People pay a lot of money for my art and I am high in demand."
27b2c926-5e32-4d2d-a629-1769a0d31074,0,Rachel loved to sing.,""" Rachel was hated to sing "".",Rachel loved to sing. Her parents and friends told her she was good at it. Rachel uploaded videos onto YouTube of her singing. People said she was off key and terrible.,""" Rachel was hated to sing "". Her parents and friends told her she was good at it. Rachel uploaded videos onto YouTube of her singing. People said she was off key and terrible."
03ebded4-9275-473a-a9b4-16e2abdecd67,1,He was looking forward to visiting the science museum.,"""He was looking forward to visiting the science museum.""",Peter was excited about the class field trip. He was looking forward to visiting the science museum. The place had many cool exhibits and interactive displays. Peter was fascinated by the physics and space demonstrations.,"Peter was excited about the class field trip. ""He was looking forward to visiting the science museum."" The place had many cool exhibits and interactive displays. Peter was fascinated by the physics and space demonstrations."
522ac383-05c4-4e2d-8e0f-da9f43059dbe,0,Peyton and Tom played football often.,Peyton and Tom never played football.,Peyton and Tom played football often. Tom always won for many years. Peyton never gave up and kept practicing. Peyton finally beat Tom at a game of football.,Peyton and Tom never played football. Tom always won for many years. Peyton never gave up and kept practicing. Peyton finally beat Tom at a game of football.
4e1c3a87-e04c-4e15-a6b1-770ff062248d,1,He spent years saving his money.,"""He spent years losing his money.""","Randy wanted to buy a house very badly. He spent years saving his money. After a decade of saving, he had enough for a down payment. Randy got approved on his mortgage and bought his home.","Randy wanted to buy a house very badly. ""He spent years losing his money."" After a decade of saving, he had enough for a down payment. Randy got approved on his mortgage and bought his home."
bc9a7dd2-191e-413c-b6c0-7dfb3f6fcaf8,1,He went around his house and began to shut off extra lights.,He went around his house and began to go on extra lights.,"Ray looked at his monthly power bill with anger. He went around his house and began to shut off extra lights. On his second trip around the house, he unplugged extra electronics. Ray sat in the darkness with satisfaction.","Ray looked at his monthly power bill with anger. He went around his house and began to go on extra lights. On his second trip around the house, he unplugged extra electronics. Ray sat in the darkness with satisfaction."
d37489d6-b8a1-4d68-a96b-e0c3a8d7b3f5,0,Ray was cooking pork chops.,"""Ray was chopping onions.""",Ray was cooking pork chops. When he was done he shouted to the family. No one ate the pork chops. Ray was sad.,"""Ray was chopping onions."" When he was done he shouted to the family. No one ate the pork chops. Ray was sad."
1505ab70-41c7-48a7-ba19-e485cab788ab,1,He was getting ready to play a game but realized he forgot his wallet.,He was getting ready to play a game but realized he forgot to get his wallet.,Rene was at the arcade with a couple of friends on a Friday night. He was getting ready to play a game but realized he forgot his wallet. His friend Jack noticed this and offered to let him borrow money. Rene appreciated his offer and took him up on it.,Rene was at the arcade with a couple of friends on a Friday night. He was getting ready to play a game but realized he forgot to get his wallet. His friend Jack noticed this and offered to let him borrow money. Rene appreciated his offer and took him up on it.
c524abe8-394b-4f68-9e72-bfa3b17f6d04,2,The eye doctor tells Rex that he needs to start wearing glasses.,""" The eye doctor tells Rex he should be wearing glasses.""",Rex notices that he has trouble seeing objects that are far away. He decides to have his eyes tested. The eye doctor tells Rex that he needs to start wearing glasses. Rex finds that he loves his new look with glasses.,"Rex notices that he has trouble seeing objects that are far away. He decides to have his eyes tested. "" The eye doctor tells Rex he should be wearing glasses."" Rex finds that he loves his new look with glasses."
4f129796-acf4-42b1-9193-ebbf193b8ca0,2,Rick fell on the first hurdle.,"""Rick won on the first hurdle.""",Rick was running an obstacle course. The first obstacle was a series of hurdles. Rick fell on the first hurdle. Rick ended the race in the last place.,"Rick was running an obstacle course. The first obstacle was a series of hurdles. ""Rick won on the first hurdle."" Rick ended the race in the last place."
fd6dbf5f-cc61-4c06-8643-5b4143e60570,1,His oldest daughter is studying to be a police investigator.,His youngest daughter is studying to be a police officer.,"Richard lives in the Philippines with his wife and two daughters. His oldest daughter is studying to be a police investigator. His youngest daughter will graduate high school this May. Right after Micah graduates, the family is moving to America.","Richard lives in the Philippines with his wife and two daughters. His youngest daughter is studying to be a police officer. His youngest daughter will graduate high school this May. Right after Micah graduates, the family is moving to America."
463e7e77-d6ac-4cd7-929d-268a8f722c9c,0,Rory loved to eat chocolate.,Rory hated to eat chocolate.,"Rory loved to eat chocolate. One day, she went to the candy store. She spent all of her allowance on chocolate bars. Rory ate all of the chocolate on the way home.","Rory hated to eat chocolate. One day, she went to the candy store. She spent all of her allowance on chocolate bars. Rory ate all of the chocolate on the way home."
46660e5c-6178-4316-9ce6-dab27ccd12bf,1,She grabbed one from the fridge.,She ate one from the cooler.,Sally liked the seltzer waters her mom bought. She grabbed one from the fridge. She was excited to open it and taste it. Sally didn't know her brother shook all of them beforehand.,Sally liked the seltzer waters her mom bought. She ate one from the cooler. She was excited to open it and taste it. Sally didn't know her brother shook all of them beforehand.
662a01d8-b9e6-44a0-8ba7-efca1869a068,0,Sally loved horses.,""" Sally hated horses "".",Sally loved horses. She always wanted one of her own. Her parents said she would get one if she did well in school. Sally studied extra hard and made all As.,""" Sally hated horses "". She always wanted one of her own. Her parents said she would get one if she did well in school. Sally studied extra hard and made all As."
30a9df5e-9326-4703-a763-2516288828e2,1,She skipped everywhere she went.,She crawled everywhere she went.,Sally liked to skip. She skipped everywhere she went. She was skipping down the sidewalk one day. Sally tripped and fell down hard.,Sally liked to skip. She crawled everywhere she went. She was skipping down the sidewalk one day. Sally tripped and fell down hard.
469eb4d8-cd8a-4cc8-9b1c-b316e791ec7f,1,He decided to give them their own place to dig.,He decided to give them a place to dig.,Sam's Siberian Huskies dig huge holes all over the yard. He decided to give them their own place to dig. He sectioned off an area with bricks. Sam made a habit of burying treats and toys in that area.,Sam's Siberian Huskies dig huge holes all over the yard. He decided to give them a place to dig. He sectioned off an area with bricks. Sam made a habit of burying treats and toys in that area.
114ce1f9-ae5e-4fc0-9780-f97fca2be21c,0,Sam opened his email to a new insurance premium.,Sam opened his email to a new job offer.,Sam opened his email to a new insurance premium. He quite literally spat coffee when he saw the final tally. He steamed that the jokers had raised his rate by fifty dollars! Sam spent the whole day shopping around for a new insurance broker.,Sam opened his email to a new job offer. He quite literally spat coffee when he saw the final tally. He steamed that the jokers had raised his rate by fifty dollars! Sam spent the whole day shopping around for a new insurance broker.
8ed27013-40bb-418a-8092-5cda69ad0a0f,2,Sam fell and broke his arm.,"""Sam climbed and broke his arm.""",Sam decided to go skateboarding on the street. Sam was doing well until a car swerved in front of him. Sam fell and broke his arm. Sam went to the hospital and his arm was put in a cast.,"Sam decided to go skateboarding on the street. Sam was doing well until a car swerved in front of him. ""Sam climbed and broke his arm."" Sam went to the hospital and his arm was put in a cast."
c4e88c8a-c4e5-4acc-abab-31f3bc8f0eeb,1,He makes a dentist appointment.,He makes a medical appointment.,Sam has a toothache. He makes a dentist appointment. Sam is very nervous. Sam's dentist is very nice and gentle.,Sam has a toothache. He makes a medical appointment. Sam is very nervous. Sam's dentist is very nice and gentle.
ae1e675d-9286-44d1-b3d0-b526f998ad4e,1,She went to walk her dog.,She went to feed her dog.,Samantha went to the park in the morning. She went to walk her dog. Her dog pooped on the grass. Samantha forgot to carry a plastic bag.,Samantha went to the park in the morning. She went to feed her dog. Her dog pooped on the grass. Samantha forgot to carry a plastic bag.
14fcbbb1-fa2b-4d31-850a-b2dc5269e9f0,0,Samantha was happy to go away for the summer.,Sabina was sad to be gone for the summer.,"Samantha was happy to go away for the summer. She told all of her friends that she was going to Hawaii. At the last minute, her brother gets sick. Samantha vacation was canceled.","Sabina was sad to be gone for the summer. She told all of her friends that she was going to Hawaii. At the last minute, her brother gets sick. Samantha vacation was canceled."
21370b7a-2cf8-4bdd-9b76-b21bd2c6ca0c,0,Sandy recently lost her job.,Sandy recently won her job.,"Sandy recently lost her job. As a consequence, Sandy could not pay her mortgage. After several months, Sandy's got some bad news. Sandy was told her house was being foreclosed on.","Sandy recently won her job. As a consequence, Sandy could not pay her mortgage. After several months, Sandy's got some bad news. Sandy was told her house was being foreclosed on."
